Questions,Answers,Context,Title
What is the importance of agriculture in the global economy?,"Agriculture is essential for the global economy as it provides food, raw materials, and employment opportunities.",Agriculture,Agriculture
How does climate change affect agriculture?,"Climate change affects agriculture through extreme weather events and shifts in temperature, reducing crop yields and increasing pest pressures.",Agriculture,Agriculture
What are the main factors influencing crop yields?,"Crop yields are influenced by genetics, nutrients, water supply, pest management, and crop practices.",Agriculture,Agriculture
How is organic farming different from conventional farming?,"Organic farming avoids synthetic inputs, focusing on sustainable practices and soil health.",Agriculture,Agriculture
What are the benefits of crop rotation?,"Crop rotation improves soil fertility, reduces pests, and enhances crop productivity.",Agriculture,Agriculture
What is the role of genetically modified organisms (GMOs) in agriculture?,GMOs introduce genetic traits into crops for enhanced productivity and addressing agricultural challenges.,Agriculture,Agriculture
How do pesticides impact the environment and human health?,Pesticides control pests but can harm the environment and human health if misused.,Agriculture,Agriculture
What are the advantages and disadvantages of hydroponic farming?,Hydroponic farming optimizes resource use but requires careful nutrient management.,Agriculture,Agriculture
What is the significance of soil fertility in agriculture?,"Soil fertility affects crop growth, nutrient availability, and overall soil health.",Agriculture,Agriculture
How can sustainable agriculture practices help preserve natural resources?,"Sustainable practices conserve resources, reduce environmental impact, and promote biodiversity.",Agriculture,Agriculture
What are the main challenges faced by small-scale farmers?,"Small-scale farmers face resource limitations, market challenges, and climate vulnerability.",Agriculture,Agriculture
What is precision agriculture and how does it improve efficiency?,"Precision agriculture optimizes farming through technology, reducing costs and environmental impact.",Agriculture,Agriculture
What are the different types of irrigation systems used in agriculture?,"Irrigation methods include drip, sprinkler, and flood irrigation, based on crop and soil needs.",Agriculture,Agriculture
How does livestock farming contribute to greenhouse gas emissions?,Livestock farming contributes to greenhouse gas emissions through methane production.,Agriculture,Agriculture
What is the concept of food security and how is agriculture related to it?,"Food security relates to sufficient and accessible food for all, and agriculture plays a key role.",Agriculture,Agriculture
How do farmers manage pests and diseases in crops?,Farmers manage pests and diseases through integrated pest management practices.,Agriculture,Agriculture
What are the benefits of using cover crops?,"Cover crops control erosion, suppress weeds, and improve soil health.",Agriculture,Agriculture
How does the use of fertilizers impact water quality?,Fertilizer use can lead to water contamination and ecosystem degradation.,Agriculture,Agriculture
What are the economic implications of agricultural subsidies?,"Agricultural subsidies influence markets, production decisions, and food availability.",Agriculture,Agriculture
What role does technology play in modern agriculture?,"Technology enhances efficiency, productivity, and sustainability in modern agriculture.",Agriculture,Agriculture
How does deforestation affect agricultural practices?,"Deforestation reduces available land and disrupts ecosystems, impacting agriculture.",Agriculture,Agriculture
What are the main challenges faced by farmers in developing countries?,"Farmers in developing countries face resource constraints, infrastructure gaps, and climate risks.",Agriculture,Agriculture
What are the different methods of weed control in agriculture?,"Weed control includes mechanical cultivation, mulching, and integrated strategies.",Agriculture,Agriculture
How can crop diversification reduce the risk of crop failure?,Crop diversification mitigates the risk of crop failure and enhances resilience.,Agriculture,Agriculture
What are the key considerations for sustainable livestock farming?,"Sustainable livestock farming prioritizes animal welfare, efficiency, and environmental impact.",Agriculture,Agriculture
What is the impact of overfishing on marine ecosystems?,Overfishing depletes fish populations and disrupts marine ecosystems.,Agriculture,Agriculture
How does agriculture contribute to biodiversity loss?,Agriculture contributes to biodiversity loss through habitat destruction and monocultures.,Agriculture,Agriculture
What are the advantages and disadvantages of genetically modified crops?,Genetically modified crops offer benefits but raise concerns about environment and ethics.,Agriculture,Agriculture
How can farmers mitigate the effects of soil erosion?,Farmers mitigate soil erosion with erosion control measures and vegetative buffers.,Agriculture,Agriculture
What are the different types of farming systems around the world?,Different farming systems adapt to specific conditions and production goals.,Agriculture,Agriculture
